<?xml version="1.0"  encoding="US-ASCII"?>

<!DOCTYPE assetlist SYSTEM "AssetList.ldm.dtd" [
<!ENTITY NetworkPrototypes SYSTEM "TransportationNetworkPrototypes.ldm.xml">
<!ENTITY SeaportPrototypes SYSTEM "SeaportPrototypes.ldm.xml">]>

<!--
/***********************************************************************************
 *                                                                                 *
 * This is open-source software developed by the TOPS team of BBN Technologies     *
 * under DARPA's ALPINE program. You can modify the software and redistribute it,  *
 * but you CANNOT DELETE OR MODIFY THIS COMMENT.                                   *
 *                                                                                 *
 * This software is distributed in the hope that it will be useful,                *
 * but WITHOUT ANY WARRANTY; without even the implied warranty of                  *
 * MERCHANTABILITY or FITNESS FOR A PARTICULAR PURPOSE.                            *
 *                                                                                 *
 * For details on the ALPINE open-source license please write:                     *
 * alpine-support@bbn.com                                                          *
 *                                                                                 *
 * Copyright (C) 1998, 1999 BBN Technologies                                       *
 *                                                                                 *
 ***********************************************************************************/
-->


<AssetList>

  <!-- ::::::::::::::::::::::::::::::::::::::::::::::::::::::::::::::::::: -->
  <!-- :::                    First the Prototypes                     ::: -->
  <!-- ::::::::::::::::::::::::::::::::::::::::::::::::::::::::::::::::::: -->

  &SeaportPrototypes;
  &NetworkPrototypes;

  <!-- ::::::::::::::::::::::::::::::::::::::::::::::::::::::::::::::::::: -->
  <!-- :::                      Now the Instances                      ::: -->
  <!-- ::::::::::::::::::::::::::::::::::::::::::::::::::::::::::::::::::: -->

  <instance prototype="SAVANNAH_PORT" id="SAVANNAH_PORT">
    <schedule end="12/31/06" start="01/01/00"/>
  </instance>

  <instance prototype="BEAUMONT_PORT" id="BEAUMONT_PORT">
    <schedule end="12/31/06" start="01/01/00"/>
  </instance>

  <instance prototype="SUNNY_POINT_PORT" id="SUNNY_POINT_PORT">
    <schedule end="12/31/06" start="01/01/00"/>
  </instance>

  <instance prototype="GENOA_PORT" id="GENOA_PORT">
    <schedule end="12/31/06" start="01/01/00"/>
  </instance>

  <instance prototype="MASSAWA_PORT" id="MASSAWA_PORT">
    <schedule end="12/31/06" start="01/01/00"/>
  </instance>

  <instance prototype="MERSIN_PORT" id="MERSIN_PORT">
    <schedule end="12/31/06" start="01/01/00"/>
  </instance>

  <instance prototype="ISKENDERUN_PORT" id="ISKENDERUN_PORT">
    <schedule end="12/31/06" start="01/01/00"/>
  </instance>

  <instance prototype="BREMERHAVEN_PORT" id="BREMERHAVEN_PORT">
    <schedule end="12/31/06" start="01/01/00"/>
  </instance>

  <instance prototype="ATHENS_PORT" id="ATHENS_PORT">
    <schedule end="12/31/06" start="01/01/00"/>
  </instance>

  <instance prototype="PALERMO_PORT" id="PALERMO_PORT">
    <schedule end="12/31/06" start="01/01/00"/>
  </instance>

  <instance prototype="NAPLES_PORT" id="NAPLES_PORT">
    <schedule end="12/31/06" start="01/01/00"/>
  </instance>

  <instance prototype="LIVORNO_PORT" id="LIVORNO_PORT">
    <schedule end="12/31/06" start="01/01/00"/>
  </instance>

  <instance prototype="MONOPOLI_PORT" id="MONOPOLI_PORT">
    <schedule end="12/31/06" start="01/01/00"/>
  </instance>

  <instance prototype="ROTTERDAM_PORT" id="ROTTERDAM_PORT">
    <schedule end="12/31/06" start="01/01/00"/>
  </instance>

  <instance prototype="IZMIR_PORT" id="IZMIR_PORT">
    <schedule end="12/31/06" start="01/01/00"/>
  </instance>

  <instance prototype="FELIXSTOWE_PORT" id="FELIXSTOWE_PORT">
    <schedule end="12/31/06" start="01/01/00"/>
  </instance>

</AssetList>
