<?xml version="1.0"  encoding="US-ASCII"?>

<!DOCTYPE assetlist SYSTEM "AssetList.ldm.dtd" [
<!ENTITY NetworkPrototypes SYSTEM "TransportationNetworkPrototypes.ldm.xml">
<!ENTITY AmmoShipPrototypes SYSTEM "AmmoShipPrototypes.ldm.xml">
<!ENTITY ShipPrototypes SYSTEM "ShipPrototypes.ldm.xml">
<!ENTITY dummyprototypes SYSTEM "DummyPrototypes.ldm.xml">]>

<!--
-->

<AssetList>

  <!-- ::::::::::::::::::::::::::::::::::::::::::::::::::::::::::::::::::: -->
  <!-- :::                    First the Prototypes                     ::: -->
  <!-- ::::::::::::::::::::::::::::::::::::::::::::::::::::::::::::::::::: -->

  &ShipPrototypes;
  &AmmoShipPrototypes;
  &NetworkPrototypes;
  &dummyprototypes;

  <!-- ::::::::::::::::::::::::::::::::::::::::::::::::::::::::::::::::::: -->
  <!-- :::                      Now the Instances                      ::: -->
  <!-- ::::::::::::::::::::::::::::::::::::::::::::::::::::::::::::::::::: -->

<!-- LMSR|RORO|Combo Ships -->

<!-- see http://www.msc.navy.mil/inventory/inventory.asp?var=LMSRship -->
<!-- for brief info on all these ships -->
<!-- BOZO : the prototype info is not right currently and needs to be updated -->
<!-- GWFV 01/17/01 -->

  <instance prototype="Bob_Hope_Prototype" id="Mendonca">
    <schedule end="12/31/06" start="01/01/00"/>
  </instance>

  <instance prototype="Gordon_Prototype" id="Gordon">
    <schedule end="12/31/06" start="01/01/00"/>
  </instance>

  <instance prototype="Gordon_Prototype" id="Gilliland">
    <schedule end="12/31/06" start="01/01/00"/>
  </instance>

  <instance prototype="Shughart_Prototype" id="Shughart">
    <schedule end="12/31/06" start="01/01/00"/>
  </instance>

  <instance prototype="Shughart_Prototype" id="Yano">
    <schedule end="12/31/06" start="01/01/00"/>
  </instance>

  <instance prototype="Bob_Hope_Prototype" id="Pililaau">
    <schedule end="12/31/06" start="01/01/00"/>
  </instance>

  <instance prototype="Watson_Prototype" id="Sisler">
    <schedule end="12/31/06" start="01/01/00"/>
  </instance>
</AssetList>