<?xml version="1.0"  encoding="US-ASCII"?>

<!DOCTYPE assetlist SYSTEM "AssetList.ldm.dtd" [
<!ENTITY NetworkPrototypes SYSTEM "TransportationNetworkPrototypes.ldm.xml">
<!ENTITY AmmoShipPrototypes SYSTEM "AmmoShipPrototypes.ldm.xml">
<!ENTITY ShipPrototypes SYSTEM "ShipPrototypes.ldm.xml">
<!ENTITY dummyprototypes SYSTEM "DummyPrototypes.ldm.xml">]>

<!--
-->

<AssetList>

  <!-- ::::::::::::::::::::::::::::::::::::::::::::::::::::::::::::::::::: -->
  <!-- :::                    First the Prototypes                     ::: -->
  <!-- ::::::::::::::::::::::::::::::::::::::::::::::::::::::::::::::::::: -->

  &ShipPrototypes;
  &AmmoShipPrototypes;
  &NetworkPrototypes;
  &dummyprototypes;

  <!-- ::::::::::::::::::::::::::::::::::::::::::::::::::::::::::::::::::: -->
  <!-- :::                      Now the Instances                      ::: -->
  <!-- ::::::::::::::::::::::::::::::::::::::::::::::::::::::::::::::::::: -->

<!-- LMSR|RORO|Combo Ships -->

  <instance prototype="Bob_Hope_Prototype" id="Bob_Hope">
    <schedule end="12/31/06" start="01/01/00"/>
  </instance>

  <instance prototype="Fisher_Prototype" id="Fisher">
    <schedule end="12/31/06" start="01/01/00"/>
  </instance>

  <instance prototype="Gilliland_Prototype" id="Gilliland">
    <schedule end="12/31/06" start="01/01/00"/>
  </instance>

  <instance prototype="Shughart_Prototype" id="Shughart">
    <schedule end="12/31/06" start="01/01/00"/>
  </instance>

  <instance prototype="Sisler_Prototype" id="Sisler">
    <schedule end="12/31/06" start="01/01/00"/>
  </instance>

  <instance prototype="Watson_Prototype" id="Watson">
    <schedule end="12/31/06" start="01/01/00"/>
  </instance>

  <instance prototype="Gordon_Prototype" id="Gordon">
    <schedule end="12/31/06" start="01/01/00"/>
  </instance>

  <instance prototype="Yano_Prototype" id="Yano">
    <schedule end="12/31/06" start="01/01/00"/>
  </instance>

<!-- see http://www.msc.navy.mil/cgi-bin/inventory-ship.pl?var=Ammunitionship -->
<!-- for brief info on all these ships -->
<!-- BOZO : the prototype info is not right currently and needs to be updated -->
<!-- GWFV 01/17/01 -->

  <instance prototype="Butte_Prototype" id="Butte">
    <schedule end="12/31/06" start="01/01/00"/>
  </instance>

  <instance prototype="Butte_Prototype" id="Flint">
    <schedule end="12/31/06" start="01/01/00"/>
  </instance>

  <instance prototype="Butte_Prototype" id="Kilauea">
    <schedule end="12/31/06" start="01/01/00"/>
  </instance>

  <instance prototype="Butte_Prototype" id="Kiska">
    <schedule end="12/31/06" start="01/01/00"/>
  </instance>

  <instance prototype="Butte_Prototype" id="Mount_Baker">
    <schedule end="12/31/06" start="01/01/00"/>
  </instance>

  <instance prototype="Butte_Prototype" id="Santa_Barbara">
    <schedule end="12/31/06" start="01/01/00"/>
  </instance>

  <instance prototype="Butte_Prototype" id="Shasta">
    <schedule end="12/31/06" start="01/01/00"/>
  </instance>

  <instance prototype="Butte_Prototype" id="Shasta_Mark_II">
    <schedule end="12/31/06" start="01/01/00"/>
  </instance>
</AssetList>


