<?xml version="1.0"  encoding="US-ASCII"?>

<!DOCTYPE assetlist SYSTEM "AssetList.ldm.dtd" [
<!ENTITY NetworkPrototypes SYSTEM "TransportationNetworkPrototypes.ldm.xml">
<!ENTITY AmmoShipPrototypes SYSTEM "AmmoShipPrototypes.ldm.xml">
<!ENTITY ShipPrototypes SYSTEM "ShipPrototypes.ldm.xml">
<!ENTITY dummyprototypes SYSTEM "DummyPrototypes.ldm.xml">]>

<!--
-->

<AssetList>

  <!-- ::::::::::::::::::::::::::::::::::::::::::::::::::::::::::::::::::: -->
  <!-- :::                    First the Prototypes                     ::: -->
  <!-- ::::::::::::::::::::::::::::::::::::::::::::::::::::::::::::::::::: -->

  &ShipPrototypes;
  &AmmoShipPrototypes;
  &NetworkPrototypes;
  &dummyprototypes;

  <!-- ::::::::::::::::::::::::::::::::::::::::::::::::::::::::::::::::::: -->
  <!-- :::                      Now the Instances                      ::: -->
  <!-- ::::::::::::::::::::::::::::::::::::::::::::::::::::::::::::::::::: -->

<!-- LMSR|RORO|Combo Ships -->

<!-- see http://www.msc.navy.mil/inventory/inventory.asp?var=LMSRship -->
<!-- for brief info on all these ships -->
<!-- BOZO : the prototype info is not right currently and needs to be updated -->
<!-- GWFV 01/17/01 -->

  <instance prototype="Bob_Hope_Prototype" id="Bob_Hope">
    <schedule end="12/31/06" start="01/01/00"/>
  </instance>

  <instance prototype="Bob_Hope_Prototype" id="Benavidez">
    <schedule end="12/31/06" start="01/01/00"/>
  </instance>

  <instance prototype="Bob_Hope_Prototype" id="Brittin">
    <schedule end="12/31/06" start="01/01/00"/>
  </instance>

  <instance prototype="Bob_Hope_Prototype" id="Fisher">
    <schedule end="12/31/06" start="01/01/00"/>
  </instance>

  <instance prototype="Bob_Hope_Prototype" id="Seay">
    <schedule end="12/31/06" start="01/01/00"/>
  </instance>

  <instance prototype="Watson_Prototype" id="Watson">
    <schedule end="12/31/06" start="01/01/00"/>
  </instance>

  <instance prototype="Watson_Prototype" id="Sisler">
    <schedule end="12/31/06" start="01/01/00"/>
  </instance>
</AssetList>